Question	Answer	Source	Metadata
ขอบคุณค่ะ	พี่หมี ยินดีให้บริการค่ะ :)	https://raw.githubusercontent.com/facgure/Bot-Knowledge-Base/master/www.nhso.go.th/QnA-00001.tsv
ขอบคุณนะ	พี่หมี ยินดีให้บริการค่ะ :)	https://raw.githubusercontent.com/facgure/Bot-Knowledge-Base/master/www.nhso.go.th/QnA-00001.tsv
ขอบคุณ	พี่หมี ยินดีให้บริการค่ะ :)	https://raw.githubusercontent.com/facgure/Bot-Knowledge-Base/master/www.nhso.go.th/QnA-00001.tsv
ขอบใจมาก	พี่หมี ยินดีให้บริการค่ะ :)	https://raw.githubusercontent.com/facgure/Bot-Knowledge-Base/master/www.nhso.go.th/QnA-00001.tsv
ขอบใจ	พี่หมี ยินดีให้บริการค่ะ :)	https://raw.githubusercontent.com/facgure/Bot-Knowledge-Base/master/www.nhso.go.th/QnA-00001.tsv
hi	สวัสดีค่ะ นี่พี่หมีนะคะ บริการสอบถามข้อมูลผู้มีสิทธิหลักประกันสุขภาพแห่งชาติค่ะ พี่หมีอ้างอิงข้อมูลจาก https://www.nhso.go.th/frontend/page-forhospital_faq.aspx ยินดีให้บริการ	https://raw.githubusercontent.com/facgure/Bot-Knowledge-Base/master/www.nhso.go.th/QnA-00001.tsv
พี่หมี บริการอะไร	สวัสดีค่ะ นี่พี่หมีนะคะ บริการสอบถามข้อมูลผู้มีสิทธิหลักประกันสุขภาพแห่งชาติค่ะ พี่หมีอ้างอิงข้อมูลจาก https://www.nhso.go.th/frontend/page-forhospital_faq.aspx ยินดีให้บริการ	https://raw.githubusercontent.com/facgure/Bot-Knowledge-Base/master/www.nhso.go.th/QnA-00001.tsv
hello	สวัสดีค่ะ นี่พี่หมีนะคะ บริการสอบถามข้อมูลผู้มีสิทธิหลักประกันสุขภาพแห่งชาติ อ้างอิงข้อมูลจาก https://www.nhso.go.th/frontend/page-forhospital_faq.aspx ยินดีให้บริการ	https://raw.githubusercontent.com/facgure/Bot-Knowledge-Base/master/www.nhso.go.th/QnA-00001.tsv
สามี ชาว ต่างประเทศ	ไม่มีสิทธิล่ะ  เนื่องจากไม่ใช่ผู้มีสัญชาติไทย การออกสูติบัตรและหมายเลขประจำตัวประชาชน 13 หลักนั้น เป็นการออกให้ตามมาตรา 20 แห่งพระราชบัญญัติการทะเบียนราษฎร (ฉบับที่ 2) พ.ศ.2551 ซึ่งไม่ใช่การรับรองหรือการให้สัญชาติไทย เด็กหญิงมุยจึงไม่ใช่ผู้มีสิทธิหลักประกันสุขภาพแห่งชาติ ปัจจุบันสำนักงานปลัดกระทรวงสาธารณสุขได้ดำเนินการขายบัตรประกันสุขภาพแห่งชาติให้กับกลุ่มดังกล่าว เพื่อใช้สิทธิในการรักษาพยาบาล โดยติดต่อขอซื้อบัตรดังกล่าวได้ที่ รพ. รัฐสังกัดกระทรวงสาธารณสุขใกล้บ้าน	https://raw.githubusercontent.com/facgure/Bot-Knowledge-Base/master/www.nhso.go.th/QnA-00001.tsv
ยาคุมกำเนิด เมื่อก่อน ปัจจุบันต้องการมีบุตร เอา ยาฝังคุมกำเนิดออก ได้หรือไม่	ได้เลย เนื่องจากยาฝัง เป็นการคุมกำเนิดชนิดชั่วคราว เมื่อประสงค์มีบุตรก็สามารถผ่าตัดนำออกได้	https://raw.githubusercontent.com/facgure/Bot-Knowledge-Base/master/www.nhso.go.th/QnA-00001.tsv
ตรวจสุขภาพ ประจำปี	ได้จ่ะ  โดยจะเป็นการตรวจคัดกรองความเสี่ยง  การซักประวัติพฤติกรรมสุขภาพและตรวจสุขภาพทั่วไปตามความจำเป็นและประเมินความเสี่ยงต่อการเกิดโรค	https://raw.githubusercontent.com/facgure/Bot-Knowledge-Base/master/www.nhso.go.th/QnA-00001.tsv
ฉีดวัคซีน	ไม่ได้นะ เนื่องจากวัคซีนดังกล่าวไม่อยู่ในแผนการสร้างเสริมภูมิคุ้มกันโรคในเด็กไทย	https://raw.githubusercontent.com/facgure/Bot-Knowledge-Base/master/www.nhso.go.th/QnA-00001.tsv
ลูกสาว	ไม่ได้นะ เนื่องจากวัคซีนดังกล่าวไม่อยู่ในแผนการสร้างเสริมภูมิคุ้มกันโรคในเด็กไทย	https://raw.githubusercontent.com/facgure/Bot-Knowledge-Base/master/www.nhso.go.th/QnA-00001.tsv